{
  "$schema": "https://santaka.dev/schema/registry-item-v1.json",
  "schemaVersion": 1,
  "name": "switch",
  "namespace": null,
  "type": "component",
  "frameworks": [
    "react",
    "vue",
    "svelte",
    "angular",
    "web-components"
  ],
  "stability": "stable",
  "behaviorOwner": "web-components",
  "version": "0.1.0",
  "dependencies": {},
  "peerDependencies": {},
  "registryDependencies": [],
  "files": [
    {
      "path": "src/components/sk-switch/sk-switch.tsx",
      "type": "registry:component",
      "checksum": "sha256-dccd4e432b684349a2b4615f6631b1af234adb5468e939ae572a0ed9fae4e869"
    },
    {
      "path": "src/components/sk-switch/sk-switch.css",
      "type": "registry:style",
      "checksum": "sha256-0980a90c3646d0d7937d9e80b04d90ff2847227f747f642f5e9355514b901081"
    }
  ],
  "cssVariables": [
    "--sk-border-thick",
    "--sk-color-border-strong",
    "--sk-color-danger",
    "--sk-color-focus-ring",
    "--sk-color-primary",
    "--sk-color-primary-fg",
    "--sk-color-shadow",
    "--sk-color-surface",
    "--sk-color-surface-sunken",
    "--sk-color-text",
    "--sk-color-text-muted",
    "--sk-duration-control",
    "--sk-duration-control-fast",
    "--sk-ease-arcade",
    "--sk-ease-arcade-exit",
    "--sk-font-sans",
    "--sk-ring-offset",
    "--sk-ring-width",
    "--sk-shadow-brutal",
    "--sk-shadow-brutal-active",
    "--sk-shadow-brutal-none",
    "--sk-space-1",
    "--sk-space-3",
    "--sk-text-base-line-height",
    "--sk-text-base-size",
    "--sk-text-lg-size",
    "--sk-text-sm-line-height",
    "--sk-text-sm-size",
    "--sk-touch-min"
  ],
  "localesCovered": [
    "en-US"
  ],
  "license": "MIT",
  "props": [
    {
      "name": "checked",
      "type": "boolean",
      "default": "false",
      "description": "Whether the switch is on. An ARIA-mirroring boolean, so the ARIA name verbatim (ADR-013, decision 1) — not `isOn`."
    },
    {
      "name": "defaultChecked",
      "type": "boolean",
      "default": "false",
      "description": "Initial state for the uncontrolled case."
    },
    {
      "name": "description",
      "type": "string",
      "default": "\"\"",
      "description": "Persistent helper text below the row."
    },
    {
      "name": "disabled",
      "type": "boolean",
      "default": "false",
      "description": "Disables interaction. Mirrors the ARIA name."
    },
    {
      "name": "error",
      "type": "string",
      "default": "\"\"",
      "description": "The validation message. Its presence drives `aria-invalid`."
    },
    {
      "name": "form",
      "type": "string",
      "default": null,
      "description": "Associates the control with a form it is not nested inside."
    },
    {
      "name": "invalid",
      "type": "boolean",
      "default": "false",
      "description": "Marks the field invalid, with the same independence from `error` as Checkbox."
    },
    {
      "name": "label",
      "type": "string",
      "default": "\"\"",
      "description": "The label text, rendered beside the track. Wraps the control."
    },
    {
      "name": "required",
      "type": "boolean",
      "default": "false",
      "description": "Native constraint validation still applies and is never suppressed."
    },
    {
      "name": "size",
      "type": "\"sm\" | \"md\" | \"lg\"",
      "default": "\"md\"",
      "description": "Label text size. The row target stays 44px at every size."
    },
    {
      "name": "value",
      "type": "string",
      "default": "\"on\"",
      "description": "The submitted value when on. `\"on\"` is the platform default, kept so a plain form reads exactly what a native checkbox-role=switch would send."
    },
    {
      "name": "variant",
      "type": "\"default\" | \"quiet\"",
      "default": "\"default\"",
      "description": "Visual emphasis."
    },
    {
      "name": "name",
      "type": "string",
      "default": null,
      "description": "The name of the element, used when submitting an HTML form."
    }
  ],
  "events": [
    "sk-value-change"
  ],
  "ai": {
    "summary": "An on/off control that acts immediately, rendered as a native checkbox carrying role=switch so the browser keeps validation and form submission.",
    "whenToUse": [
      "The setting applies the moment it is toggled — a preference, a visibility toggle",
      "The state is genuinely binary: on or off, with no third state",
      "It must submit through a plain `<form>` with no JavaScript state"
    ],
    "whenNotToUse": [
      "The choice is collected for a later submit — use a Checkbox",
      "The choice is one of several exclusive options — use a Radio Group",
      "The action triggers something rather than setting a state — use a Button"
    ],
    "accessibility": "Renders a real native `<input type=\"checkbox\">` carrying `role=\"switch\"`, so the browser supplies constraint validation, Space-to-toggle, and autofill while assistive technology reads the state as on/off. The label wraps the input, making the whole row the activation target with no click handler. `label`, `description`, and `error` are wired through the wrapping label and `aria-describedby`; an error sets `aria-invalid` and renders an icon beside its text, never color alone (WCAG 1.4.1). Implements the FACE contract: formResetCallback, formDisabledCallback, formStateRestoreCallback, and sk-value-change fires only for user-initiated changes.",
    "example": "<sk-switch name=\"dark\" label=\"Dark mode\"></sk-switch>",
    "knownLimitations": [
      "The generated `id` for the inner control differs from React's `useId()`, so an SSR consumer must pass an explicit `id` for a separately-rendered `Label` to find it (section 4, forms contract)"
    ],
    "localesCovered": [
      "en-US"
    ]
  }
}
