{
  "$schema": "https://santaka.my.id/schema/registry-item-v1.json",
  "schemaVersion": 1,
  "name": "textarea",
  "namespace": null,
  "type": "component",
  "frameworks": [
    "react",
    "vue",
    "svelte",
    "angular",
    "web-components"
  ],
  "stability": "stable",
  "behaviorOwner": "web-components",
  "version": "0.1.0",
  "dependencies": {},
  "peerDependencies": {},
  "registryDependencies": [],
  "files": [
    {
      "path": "src/components/sk-textarea/sk-textarea.tsx",
      "type": "registry:component",
      "checksum": "sha256-7dbc8107be1621f10076ea95efa2ad7b1671f710ae1d44a2ebc098f8984e92aa"
    },
    {
      "path": "src/components/sk-textarea/sk-textarea.css",
      "type": "registry:style",
      "checksum": "sha256-9e54a84dd75f57d6b3fef6f792749fedac16c480d30b18bf4d508053625d7bba"
    }
  ],
  "cssVariables": [
    "--sk-border-thick",
    "--sk-color-border-strong",
    "--sk-color-danger",
    "--sk-color-focus-ring",
    "--sk-color-shadow",
    "--sk-color-surface",
    "--sk-color-surface-sunken",
    "--sk-color-text",
    "--sk-color-text-muted",
    "--sk-duration-control",
    "--sk-duration-control-fast",
    "--sk-ease-arcade",
    "--sk-ease-arcade-exit",
    "--sk-font-sans",
    "--sk-icon-sm",
    "--sk-ring-offset",
    "--sk-ring-width",
    "--sk-shadow-brutal",
    "--sk-shadow-brutal-active",
    "--sk-shadow-brutal-none",
    "--sk-space-1",
    "--sk-space-2",
    "--sk-space-3",
    "--sk-text-base-line-height",
    "--sk-text-base-size",
    "--sk-text-sm-line-height",
    "--sk-text-sm-size",
    "--sk-text-sm-weight",
    "--sk-text-xs-line-height",
    "--sk-text-xs-size",
    "--sk-text-xs-weight",
    "--sk-touch-min"
  ],
  "localesCovered": [
    "en-US"
  ],
  "license": "MIT",
  "props": [
    {
      "name": "cols",
      "type": "number",
      "default": null,
      "description": "Visible columns, for the few cases where it matters."
    },
    {
      "name": "defaultValue",
      "type": "string",
      "default": "\"\"",
      "description": "Initial value for the uncontrolled case."
    },
    {
      "name": "description",
      "type": "string",
      "default": "\"\"",
      "description": "Persistent helper text below the field."
    },
    {
      "name": "disabled",
      "type": "boolean",
      "default": "false",
      "description": "Disables interaction. Mirrors the ARIA name."
    },
    {
      "name": "error",
      "type": "string",
      "default": "\"\"",
      "description": "The validation message. Its presence drives `aria-invalid`."
    },
    {
      "name": "form",
      "type": "string",
      "default": null,
      "description": "Associates the control with a form it is not nested inside."
    },
    {
      "name": "invalid",
      "type": "boolean",
      "default": "false",
      "description": "Marks the field invalid independently of any error text."
    },
    {
      "name": "label",
      "type": "string",
      "default": "\"\"",
      "description": "The control's own label text, rendered above the field."
    },
    {
      "name": "maxLength",
      "type": "number",
      "default": null,
      "description": "Maximum accepted length, enforced natively. Same attribute-name reason."
    },
    {
      "name": "minLength",
      "type": "number",
      "default": null,
      "description": "Minimum accepted length, enforced natively.  Attribute-observed because Stencil's camelCase-to-kebab mapping produces `min-length`, not the native `minlength`, so `<sk-textarea minlength=\"2\">` was silently ignored — the same class of defect `readonly` had."
    },
    {
      "name": "placeholder",
      "type": "string",
      "default": "\"\"",
      "description": "Placeholder text. Never a substitute for a label."
    },
    {
      "name": "readOnly",
      "type": "boolean",
      "default": "false",
      "description": "Makes the field non-editable but still submitted and focusable.  Attribute-observed, for the same reason as `sk-input`: Stencil's camelCase-to-kebab mapping produces `read-only`, not the native `readonly`."
    },
    {
      "name": "required",
      "type": "boolean",
      "default": "false",
      "description": "Native constraint validation still applies and is never suppressed."
    },
    {
      "name": "rows",
      "type": "number",
      "default": "4",
      "description": "Visible rows. The browser's own sizing, not a pixel value."
    },
    {
      "name": "value",
      "type": "string",
      "default": "\"\"",
      "description": "The value. Uncontrolled by default: typed value only if set."
    },
    {
      "name": "variant",
      "type": "\"default\" | \"quiet\"",
      "default": "\"default\"",
      "description": "Visual emphasis."
    },
    {
      "name": "name",
      "type": "string",
      "default": null,
      "description": "The name of the element, used when submitting an HTML form."
    }
  ],
  "events": [
    "sk-value-change"
  ],
  "ai": {
    "summary": "A multi-line text field that participates in a plain HTML form, for text too long to type on one line.",
    "whenToUse": [
      "The value runs to several lines: a bio, a comment, release notes, an address",
      "The consumer wants the browser to size the field by line count",
      "It must submit through a plain `<form>` with no JavaScript state"
    ],
    "whenNotToUse": [
      "The value is a single short string — use an Input",
      "The value is one of a fixed set — use a Select or Radio Group",
      "It only toggles a boolean — use a Checkbox or Switch"
    ],
    "accessibility": "Renders a real native `<textarea>`, so the browser supplies constraint validation and the error bubble rather than this component reimplementing them. `label`, `description`, and `error` are wired through `<label for>` and `aria-describedby`; an error sets `aria-invalid` and renders an icon beside its text, never color alone (WCAG 1.4.1). The field resizes vertically by default, because long-form text is edited rather than typed in one line. Shares its form contract with Input.",
    "example": "<sk-textarea name=\"bio\" label=\"Bio\" rows=\"4\"></sk-textarea>",
    "knownLimitations": [
      "There is no `pattern` prop: a textarea has no single-line grammar for a pattern to constrain",
      "The generated `id` for the inner control differs from React's `useId()`, so an SSR consumer must pass an explicit `id` for a separately-rendered `Label` to find it (section 4, forms contract)"
    ],
    "localesCovered": [
      "en-US"
    ]
  }
}
