{
  "$schema": "https://santaka.my.id/schema/registry-item-v1.json",
  "schemaVersion": 1,
  "name": "toast",
  "namespace": null,
  "type": "component",
  "frameworks": [
    "react",
    "vue",
    "svelte",
    "angular",
    "web-components"
  ],
  "stability": "stable",
  "behaviorOwner": "web-components",
  "version": "0.1.0",
  "dependencies": {},
  "peerDependencies": {},
  "registryDependencies": [],
  "files": [
    {
      "path": "src/components/sk-toast/sk-toast.tsx",
      "type": "registry:component",
      "checksum": "sha256-18859a6d32354f79e04f0dade9b1e0c3d1e18a1cf18e160fb0ef19ea87714c0c"
    },
    {
      "path": "src/components/sk-toast/sk-toast.css",
      "type": "registry:style",
      "checksum": "sha256-693ed0edcc4699e3bc1f1c70a89efb5614a0bf896956d0634de0bc71b4f1a3ac"
    }
  ],
  "cssVariables": [
    "--sk-color-border-strong",
    "--sk-color-danger",
    "--sk-color-success",
    "--sk-color-text",
    "--sk-color-warning",
    "--sk-font-sans",
    "--sk-space-3",
    "--sk-space-4",
    "--sk-text-lg-size",
    "--sk-z-toast"
  ],
  "localesCovered": [
    "en-US"
  ],
  "license": "MIT",
  "props": [
    {
      "name": "duration",
      "type": "number",
      "default": "5000",
      "description": "Milliseconds before auto-dismiss. `0` never auto-dismisses — for an error the user must act on, an expiring message is an expired apology."
    },
    {
      "name": "open",
      "type": "boolean",
      "default": "false",
      "description": "Whether the toast is showing."
    },
    {
      "name": "variant",
      "type": "\"neutral\" | \"success\" | \"warning\" | \"danger\"",
      "default": "\"neutral\"",
      "description": "Visual severity, matching Badge's palette. Color is never the message."
    }
  ],
  "events": [
    "sk-open-change"
  ],
  "ai": {
    "summary": "A non-blocking notification on the glass material: announced politely, auto-dismissed, never stealing focus.",
    "whenToUse": [
      "A background operation finished and the user was looking somewhere else",
      "A state change should be acknowledged without interrupting work",
      "An error needs time and a close button, not a decision"
    ],
    "whenNotToUse": [
      "The user must choose before the page continues — use an Alert Dialog",
      "The message needs the page's context hidden — use a Dialog",
      "The information is permanent UI, not an event — use a Card or a Badge"
    ],
    "accessibility": "`role=\"status\"`, a polite live region: announced when it appears, never stealing focus — the user was looking somewhere else, and a toast that shouts is a dialog wearing a smaller skirt. Hover or focus pauses the auto-dismiss clock, because a message that disappears mid-read is an announcement that never happened. `duration=0` never expires: an error the user must act on deserves more than an expired apology. The close button carries a real `aria-label` — a bare × is a picture to a screen reader. Severity is a 3px left edge plus the message text, never color alone (WCAG 1.4.1).",
    "example": "<sk-toast variant=\"success\" duration=\"5000\">Build 4821 deployed.</sk-toast>",
    "knownLimitations": [
      "It is a single toast — the consumer's region owns stacking and placement",
      "It never takes focus, so keyboard users meet it only through announcement; an actionable toast needs a persistent surface"
    ],
    "localesCovered": [
      "en-US"
    ]
  }
}
